"SDTMIG v3.2","33","Findings","LB","LBTOX","Toxicity","Char","",,"","Variable Qualifier","Description of toxicity quantified by LBTOXGR. The sponsor is expected to provide the name of the scale and version used to map the terms, utilizing the define.xml external codelist attributes.","Perm"
"SDTMIG v3.2","34","Findings","LB","LBTOXGR","Standard Toxicity Grade","Char","",,"","Variable Qualifier","Records toxicity grade value using a standard toxicity scale (such as the NCI CTCAE). If value is from a numeric scale, represent only the number (e.g., ""2"" and not ""Grade 2""). The sponsor is expected to provide the name of the scale and version used to map the terms, utilizing the define.xml external codelist attributes.","Perm"
"SDTMIG v3.2","35","Findings","LB","VISITNUM","Visit Number","Num","",,"","Timing","1. Clinical encounter number.  2. Numeric version of VISIT, used for sorting.","Exp"
"SDTMIG v3.2","36","Findings","LB","VISIT","Visit Name","Char","",,"","Timing","1. Protocol-defined description of clinical encounter 2. May be used in addition to VISITNUM and/or VISITDY","Perm"
"SDTMIG v3.2","37","Findings","LB","VISITDY","Planned Study Day of Visit","Num","",,"","Timing","Planned study day of the visit based upon RFSTDTC in Demographics.","Perm"
"SDTMIG v3.2","38","Findings","LB","LBDTC","Date/Time of Specimen Collection","Char","","ISO 8601","","Timing",,"Exp"
"SDTMIG v3.2","39","Findings","LB","LBENDTC","End Date/Time of Specimen Collection","Char","","ISO 8601","","Timing",,"Perm"
"SDTMIG v3.2","40","Findings","LB","LBDY","Study Day of Specimen Collection","Num","",,"","Timing","1. Study day of specimen collection, measured as integer days.  2. Algorithm for calculations must be relative to the sponsor-defined RFSTDTC variable in Demographics. This formula should be consistent across the submission.","Perm"
"SDTMIG v3.2","41","Findings","LB","LBTPT","Planned Time Point Name","Char","",,"","Timing","1. Text Description of time when specimen should be taken.  2. This may be represented as an elapsed time relative to a fixed reference point, such as time of last dose. See LBTPTNUM and LBTPTREF. Examples: Start, 5 min post.","Perm"
"SDTMIG v3.2","42","Findings","LB","LBTPTNUM","Planned Time Point Number","Num","",,"","Timing","Numerical version of LBTPT to aid in sorting.","Perm"
"SDTMIG v3.2","43","Findings","LB","LBELTM","Planned Elapsed Time from Time Point Ref","Char","","ISO 8601","","Timing","Planned Elapsed time (in ISO 8601) relative to a planned fixed reference (LBTPTREF). This variable is useful where there are repetitive measures. Not a clock time or a date time variable. Represented as an ISO 8601 duration. Examples: ""-PT15M"" to represent the period of 15 minutes prior to the reference point indicated by LBTPTREF, or ""PT8H"" to represent the period of 8 hours after the reference point indicated by LBTPTREF.","Perm"
"SDTMIG v3.2","44","Findings","LB","LBTPTREF","Time Point Reference","Char","",,"","Timing","Name of the fixed reference point referred to by LBELTM, LBTPTNUM, and LBTPT. Examples: PREVIOUS DOSE, PREVIOUS MEAL.","Perm"
"SDTMIG v3.2","45","Findings","LB","LBRFTDTC","Date/Time of Reference Time Point","Char","","ISO 8601","","Timing","Date/time of the reference time point, LBTPTREF.","Perm"
"SDTMIG v3.2","1","Findings","MB","STUDYID","Study Identifier","Char","",,"","Identifier","Unique identifier for a study.","Req"
"SDTMIG v3.2","2","Findings","MB","DOMAIN","Domain Abbreviation","Char","",,"MB","Identifier","Two-character abbreviation for the domain.","Req"
"SDTMIG v3.2","3","Findings","MB","USUBJID","Unique Subject Identifier","Char","",,"","Identifier","Identifier used to uniquely identify a subject across all studies for all applications or submissions involving the product.","Req"
"SDTMIG v3.2","4","Findings","MB","MBSEQ","Sequence Number","Num","",,"","Identifier","Sequence Number given to ensure uniqueness of subject records within a domain. May be any valid number.","Req"
"SDTMIG v3.2","5","Findings","MB","MBGRPID","Group ID","Char","",,"","Identifier","Used to tie together a block of related records in a single domain to support relationships within the domain and between domains. In MB, used to link to findings about organisms which are stored in MS.","Exp"
"SDTMIG v3.2","6","Findings","MB","MBREFID","Reference ID","Char","",,"","Identifier","Internal or external specimen identifier. Example: Specimen ID","Perm"
"SDTMIG v3.2","7","Findings","MB","MBSPID","Sponsor-Defined Identifier","Char","",,"","Identifier","Sponsor-defined reference number. Perhaps pre-printed on the CRF as an explicit line identifier or defined in the sponsor's operational database. Example: ORGANISM IDENTIFIER. For organism identification, MBSPID would remain the same each time the same organism is identified in a new specimen.","Perm"
"SDTMIG v3.2","8","Findings","MB","MBTESTCD","Microbiology Test or Finding Short Name","Char","",,"","Topic","Short name of the measurement, test, or finding described in MBTEST. It can be used as a column name when converting a dataset from a vertical to a horizontal format. The value in MBTESTCD cannot be longer than 8 characters, nor can it start with a number (e.g., ""1TEST""). MBTESTCD cannot contain characters other than letters, numbers, or underscores. Examples for GRAM STAIN findings: GMNROD, GMNCOC, GMSQEPCE, GMPMNLOW. Examples for CULTURE PLATE findings: ORGANISM.","Req"
"SDTMIG v3.2","9","Findings","MB","MBTEST","Microbiology Test or Finding Name","Char","",,"","Synonym Qualifier","Verbatim name of the test or examination used to obtain the measurement or finding. The value in MBTEST cannot be longer than 40 characters. Examples: GRAM NEGATIVE RODS, GRAM NEGATIVE COCCI, SQUAMOUS EPITHELIAL CELLS, PMN PER FIELD LOW, ORGANISM PRESENT","Req"
"SDTMIG v3.2","10","Findings","MB","MBCAT","Category for Microbiology Finding","Char","",,"","Grouping Qualifier","Used to define a category of related records.","Perm"
"SDTMIG v3.2","11","Findings","MB","MBSCAT","Subcategory for Microbiology Finding","Char","",,"","Grouping Qualifier","Used to define a further categorization of MBCAT.","Perm"
"SDTMIG v3.2","12","Findings","MB","MBORRES","Result or Finding in Original Units","Char","",,"","Result Qualifier","Result of the Microbiology measurement or finding as originally received or collected. Examples for GRAM STAIN findings: +3 MODERATE, +2 FEW, <10. Examples for CULTURE PLATE (ORGANISM) findings: KLEBSIELLA PNEUMONIAE, STREPTOCOCCUS PNEUMONIAE.","Exp"
"SDTMIG v3.2","13","Findings","MB","MBORRESU","Original Units","Char","C71620",,"","Variable Qualifier","Original unit for MBORRES. Example: mcg/mL","Perm"
"SDTMIG v3.2","14","Findings","MB","MBSTRESC","Character Result/Finding in Std Format","Char","",,"","Result Qualifier","Contains the result value for all findings, copied or derived from MBORRES in a standard format or standard units. MBSTRESC should store all results or findings in character format; if results are numeric, they should also be stored in numeric format in MBSTRESN. For example, if a test has results ""+3 MODERATE"", ""MOD"", and ""MODERATE"" in MBORRES and these results effectively have the same meaning, they could be represented in standard format in MBSTRESC as ""MODERATE"".","Exp"
"SDTMIG v3.2","15","Findings","MB","MBSTRESN","Numeric Result/Finding in Standard Units","Num","",,"","Result Qualifier","Used for continuous or numeric results or findings in standard format; copied in numeric format from MBSTRESC. MBSTRESN should store all numeric test results or findings.","Perm"
"SDTMIG v3.2","16","Findings","MB","MBSTRESU","Standard Units","Char","C71620",,"","Variable Qualifier","Standardized unit used for MBSTRESC and MBSTRESN.","Perm"
"SDTMIG v3.2","17","Findings","MB","MBRESCAT","Result Category","Char","",,"","Variable Qualifier","Used to categorize the result of a finding in a standard format. Example for ORGANISM finding: INFECTING, COLONIZER, CONTAMINANT, or NORMAL FLORA.","Exp"
"SDTMIG v3.2","18","Findings","MB","MBSTAT","Completion Status","Char","C66789",,"","Record Qualifier","Used to indicate Microbiology was not done, or a test was not done. Should be null or have a value of NOT DONE.","Perm"
"SDTMIG v3.2","19","Findings","MB","MBREASND","Reason Microbiology Not Performed","Char","",,"","Record Qualifier","Reason not done. Used in conjunction with MBSTAT when value is NOT DONE. Examples: BROKEN EQUIPMENT or SUBJECT REFUSED.","Perm"
"SDTMIG v3.2","20","Findings","MB","MBNAM","Vendor Name","Char","",,"","Record Qualifier","Name or identifier of the laboratory or vendor who provides the test results.","Perm"
"SDTMIG v3.2","21","Findings","MB","MBLOINC","LOINC Code","Char","",,"","Synonym Qualifier","1. Dictionary-derived LOINC Code for MBTEST. 2. The sponsor is expected to provide the dictionary name and version used to map the terms utilizing the define.xml external codelist attributes","Perm"
"SDTMIG v3.2","22","Findings","MB","MBSPEC","Specimen Type","Char","C78734",,"","Record Qualifier","Defines the type of specimen used for a measurement. Examples: SPUTUM, BLOOD, PUS.","Perm"
"SDTMIG v3.2","23","Findings","MB","MBSPCCND","Specimen Condition","Char","C78733",,"","Record Qualifier","Free or standardized text describing the condition of the specimen. Example: CONTAMINATED.","Perm"
"SDTMIG v3.2","24","Findings","MB","MBLOC","Specimen Collection Location","Char","C74456",,"","Record Qualifier","Location relevant to the collection of the measurement. Examples: LUNG, VEIN, ARM, FOOT","Perm"
"SDTMIG v3.2","25","Findings","MB","MBMETHOD","Method of Test or Examination","Char","C85492",,"","Record Qualifier","Method of the test or examination. Example: GRAM STAIN, MACRO BROTH DILUTION, AGAR DILUTION","Exp"
"SDTMIG v3.2","26","Findings","MB","MBBLFL","Baseline Flag","Char","C66742",,"","Record Qualifier","Indicator used to identify a baseline value. The value should be ""Y"" or null.","Perm"
"SDTMIG v3.2","27","Findings","MB","MBDRVFL","Derived Flag","Char","C66742",,"","Record Qualifier","Used to indicate a derived record. The value should be Y or null. Records that represent the average of other records or some other derivation, and those that do not come from the CRF, are examples of records that would be derived for the submission datasets. If MBDRVFL=Y, then MBORRES may be null with MBSTRESC and (if numeric) MBSTRESN having the derived value.","Perm"
"SDTMIG v3.2","28","Findings","MB","VISITNUM","Visit Number","Num","",,"","Timing","1. Clinical encounter number. 2. Numeric version of VISIT, used for sorting.","Exp"
"SDTMIG v3.2","29","Findings","MB","VISIT","Visit Name","Char","",,"","Timing","1. Protocol-defined description of clinical encounter. 2. May be used in addition to VISITNUM and/or VISITDY.","Perm"
"SDTMIG v3.2","30","Findings","MB","VISITDY","Planned Study Day of Visit","Num","",,"","Timing","Planned study day of the visit based upon RFSTDTC in Demographics.","Perm"
"SDTMIG v3.2","31","Findings","MB","MBDTC","Date/Time of Specimen Collection","Char","","ISO 8601","","Timing",,"Exp"
"SDTMIG v3.2","32","Findings","MB","MBDY","Study Day of MB Specimen Collection","Num","",,"","Timing","1. Study day of the specimen collection, measured as integer days. 2. Algorithm for calculations must be relative to the sponsor-defined RFSTDTC variable in Demographics. This formula should be consistent across the submission.","Perm"
"SDTMIG v3.2","33","Findings","MB","MBTPT","Planned Time Point Name","Char","",,"","Timing","1. Text Description of time when specimen should be taken. 2. This may be represented as an elapsed time relative to a fixed reference point, such as time of last dose. See MBTPTNUM and MBTPTREF. Examples: Start, 5 min post.","Perm"
"SDTMIG v3.2","34","Findings","MB","MBTPTNUM","Planned Time Point Number","Num","",,"","Timing","Numerical version of MBTPT to aid in sorting.","Perm"
"SDTMIG v3.2","35","Findings","MB","MBELTM","Planned Elapsed Time from Time Point Ref","Char","","ISO 8601","","Timing","Planned elapsed time (in ISO 8601) relative to a planned fixed reference (MBTPTREF). This variable is useful where there are repetitive measures. Not a clock time or a date time variable. Represented as an ISO 8601 duration. Examples: ""-PT15M"" to represent the period of 15 minutes prior to the reference point indicated by MBTPTREF, or ""PT8H"" to represent the period of 8 hours after the reference point indicated by MBTPTREF.","Perm"
"SDTMIG v3.2","36","Findings","MB","MBTPTREF","Time Point Reference","Char","",,"","Timing","Name of the fixed reference point referred to by MBELTM, MBTPTNUM, and MBTPT. Example: PREVIOUS DOSE.","Perm"
"SDTMIG v3.2","37","Findings","MB","MBRFTDTC","Date/Time of Reference Time Point","Char","","ISO 8601","","Timing","Date/time of the reference time point, MBTPTREF.","Perm"
"SDTMIG v3.2","1","Findings","MS","STUDYID","Study Identifier","Char","",,"","Identifier","Unique identifier for a study.","Req"
"SDTMIG v3.2","2","Findings","MS","DOMAIN","Domain Abbreviation","Char","",,"MS","Identifier","Two-character abbreviation for the domain.","Req"
"SDTMIG v3.2","3","Findings","MS","USUBJID","Unique Subject Identifier","Char","",,"","Identifier","Identifier used to uniquely identify a subject across all studies for all applications or submissions involving the product.","Req"
"SDTMIG v3.2","4","Findings","MS","MSSEQ","Sequence Number","Num","",,"","Identifier","Sequence Number given to ensure uniqueness of subject records within a domain. May be any valid number.","Req"
"SDTMIG v3.2","5","Findings","MS","MSGRPID","Group ID","Char","",,"","Identifier","Used to tie together a block of related records in a single domain to support relationships within the domain and between domains. In MS, used to link to organism in MB.","Req"
"SDTMIG v3.2","6","Findings","MS","MSREFID","Reference ID","Char","",,"","Identifier","Internal or external specimen identifier. Example: Specimen ID.","Perm"
"SDTMIG v3.2","7","Findings","MS","MSSPID","Sponsor-Defined Identifier","Char","",,"","Identifier","Sponsor-defined reference number. Perhaps pre-printed on the CRF as an explicit line identifier or defined in the sponsor's operational database.","Perm"
"SDTMIG v3.2","8","Findings","MS","MSTESTCD","Microbiology Organism Finding Short Name","Char","",,"","Topic","Short name of the measurement, test, or finding described in MSTEST. It can be used as a column name when converting a dataset from a vertical to a horizontal format. The value in MSTESTCD cannot be longer than 8 characters, nor can it start with a number (e.g.""1TEST). MSTESTCD cannot contain characters other than letters, numbers, or underscores. Examples for GROWTH findings: EXTGROW, COLCOUNT. For SUSCEPTIBILITY findings, the test is the drug the organism was tested with, i.e. PENICLLN, AMOXCLLN.","Req"
"SDTMIG v3.2","9","Findings","MS","MSTEST","Organism Test or Finding Name","Char","",,"","Synonym Qualifier","Verbatim name of the test or examination used to obtain the measurement or finding. Examples for GROWTH findings: Extent of Growth, Colony Count. Examples for SUSCEPTIBILITY findings: Amoxicillin Susceptibility, Penicillin Susceptibility","Req"
"SDTMIG v3.2","10","Findings","MS","MSCAT","Category for Organism Findings","Char","",,"","Grouping Qualifier","Used to define a category of related records. Examples: GROWTH, SUSCEPTIBILITY.","Req"
"SDTMIG v3.2","11","Findings","MS","MSSCAT","Subcategory for Organism Findings","Char","",,"","Grouping Qualifier","A further categorization of a test category. Examples: CULTURE, ISOLATE","Perm"
"SDTMIG v3.2","12","Findings","MS","MSORRES","Result or Finding in Original Units","Char","",,"","Result Qualifier","Result of the Microbiology Organism measurement or finding as originally received or collected. Examples for GROWTH findings: GROWTH INTO 3RD QUADRANT. Examples for SUSCEPTIBLITY findings:.0080,.0023","Exp"
"SDTMIG v3.2","13","Findings","MS","MSORRESU","Original Units","Char","C71620",,"","Variable Qualifier","Original units in which the data were collected. The unit for MSORRES. Example: mcg/mL","Exp"
"SDTMIG v3.2","14","Findings","MS","MSSTRESC","Character Result/Finding in Std Format","Char","",,"","Result Qualifier","Contains the result value for all findings, copied or derived from MSORRES in a standard format or standard units. MSSTRESC should store all results or findings in character format; if results are numeric, they should also be stored in numeric format in MSSTRESN. For example, if a test has results ""+3 MODERATE"", ""MOD"", and ""MODERATE"", and in MSORRES and these results effectively have the same meaning, they could be represented in standard format in MSSTRESC as ""MODERATE"".","Exp"
"SDTMIG v3.2","15","Findings","MS","MSSTRESN","Numeric Result/Finding in Standard Units","Num","",,"","Result Qualifier","Used for continuous or numeric results or findings in standard format; copied in numeric format from MSSTRESC. MSSTRESN should store all numeric test results or findings.","Exp"
"SDTMIG v3.2","16","Findings","MS","MSSTRESU","Standard Units","Char","C71620",,"","Variable Qualifier","Standardized unit used for MSSTRESC and MSSTRESN.","Exp"
"SDTMIG v3.2","17","Findings","MS","MSRESCAT","Result Category","Char","C85495",,"","Variable Qualifier","Used to categorize the result of a finding in a standard format. Example for SUSCEPTIBILITY finding: SUSCEPTIBLE, INTERMEDIATE, RESISTANT, or UNKNOWN.","Exp"
"SDTMIG v3.2","18","Findings","MS","MSSTAT","Completion Status","Char","C66789",,"","Record Qualifier","Used to indicate a test on an organism was not done, or a test was not performed. Should be null if a result exists in MSORRES or have a value of NOT DONE.","Perm"
"SDTMIG v3.2","19","Findings","MS","MSREASND","Reason Test Not Done","Char","",,"","Record Qualifier","Reason not done. Describes why a measurement or test was not performed. Used in conjunction with MSSTAT when value is NOT DONE. Example: SAMPLE LOST","Perm"
"SDTMIG v3.2","20","Findings","MS","MSNAM","Vendor Name","Char","",,"","Record Qualifier","Name or identifier of the laboratory or vendor that provided the test results.","Perm"
"SDTMIG v3.2","21","Findings","MS","MSLOINC","LOINC Code","Char","",,"","Synonym Qualifier","1. Dictionary-derived LOINC Code for MSTEST. 2. The sponsor is expected to provide the dictionary name and version used to map the terms utilizing the define.xml external codelist attributes","Perm"
"SDTMIG v3.2","22","Findings","MS","MSMETHOD","Method of Test or Examination","Char","C85492",,"","Record Qualifier","Method of the test or examination. Example: GRAM STAIN, MACRO BROTH DILUTION, AGAR DILUTION","Exp"
"SDTMIG v3.2","23","Findings","MS","MSBLFL","Baseline Flag","Char","C66742",,"","Record Qualifier","Indicator used to identify a baseline value. The value should be ""Y"" or null.","Perm"
"SDTMIG v3.2","24","Findings","MS","MSDRVFL","Derived Flag","Char","C66742",,"","Record Qualifier","Used to indicate a derived record. The value should be Y or null. Records that represent the average of other records or some other derivation, and those that do not come from the CRF, are examples of records that would be derived for the submission datasets. If MSDRVFL=Y, then MSORRES may be null, with MSSTRESC and (if numeric) MSSTRESN having the derived value.","Perm"
"SDTMIG v3.2","25","Findings","MS","VISITNUM","Visit Number","Num","",,"","Timing","1. Clinical encounter number. 2. Numeric version of VISIT, used for sorting.","Exp"
"SDTMIG v3.2","26","Findings","MS","VISIT","Visit Name","Char","",,"","Timing","1. Protocol-defined description of clinical encounter. 2. May be used in addition to VISITNUM and/or VISITDY.","Perm"
"SDTMIG v3.2","27","Findings","MS","VISITDY","Planned Study Day of Visit","Num","",,"","Timing","Planned study day of the visit based upon RFSTDTC in Demographics.","Perm"
"SDTMIG v3.2","28","Findings","MS","MSDTC","Date/Time of Test","Char","","ISO 8601","","Timing",,"Perm"
"SDTMIG v3.2","29","Findings","MS","MSDY","Study Day of Test","Num","",,"","Timing","1. Study day of the test, measured as integer days. 2. Algorithm for calculations must be relative to the sponsor-defined RFSTDTC variable in Demographics. This formula should be consistent across the submission.","Perm"
"SDTMIG v3.2","30","Findings","MS","MSTPT","Planned Time Point Name","Char","",,"","Timing","1. Text Description of time when test should be done.  2. This may be represented as an elapsed time relative to a fixed reference point, such as time of last dose. See MSTPTNUM and MSTPTREF. Examples: Start, 5 min post.","Perm"
"SDTMIG v3.2","31","Findings","MS","MSTPTNUM","Planned Time Point Number","Num","",,"","Timing","Numerical version of MSTPT to aid in sorting.","Perm"
"SDTMIG v3.2","32","Findings","MS","MSELTM","Planned Elapsed Time from Time Point Ref","Char","","ISO 8601","","Timing","Elapsed time (in ISO 8601) relative to a planned fixed reference (MSTPTREF). This variable is useful where there are repetitive measures. Not a clock time or a date time variable. Examples: ""-PT15M"" to represent the period of 15 minutes prior to the reference point indicated by MSTPTREF, or ""P8H"" to represent the period of 8 hours after the reference point indicated by MSTPTREF.","Perm"
"SDTMIG v3.2","33","Findings","MS","MSTPTREF","Time Point Reference","Char","",,"","Timing","Name of the fixed reference point referred to by MSELTM, MSTPTNUM, and MSTPT. Example: PREVIOUS DOSE.","Perm"
"SDTMIG v3.2","1","Findings","MI","STUDYID","Study Identifier","Char","",,"","Identifier","Unique identifier for a study.","Req"
"SDTMIG v3.2","2","Findings","MI","DOMAIN","Domain Abbreviation","Char","",,"MI","Identifier","Two-character abbreviation for the domain.","Req"
"SDTMIG v3.2","3","Findings","MI","USUBJID","Unique Subject Identifier","Char","",,"","Identifier","Identifier used to uniquely identify a subject across all studies for all applications or submissions involving the product.","Req"
"SDTMIG v3.2","4","Findings","MI","MISEQ","Sequence Number","Num","",,"","Identifier","Sequence number given to ensure uniqueness of subject records within a domain. May be any valid number.","Req"
"SDTMIG v3.2","5","Findings","MI","MIGRPID","Group ID","Char","",,"","Identifier","Used to tie together a block of related records in a single domain for a subject. This is not the treatment group number.","Perm"
"SDTMIG v3.2","6","Findings","MI","MIREFID","Reference ID","Char","",,"","Identifier","Internal or external specimen identifier. Example: Specimen barcode number.","Perm"
"SDTMIG v3.2","7","Findings","MI","MISPID","Sponsor-Defined Identifier","Char","",,"","Identifier","Sponsor-defined reference number. Perhaps pre-printed on the CRF as an explicit line identifier or defined in the sponsor's operational database. Example: Line number from the MI Findings page.","Perm"
"SDTMIG v3.2","8","Findings","MI","MITESTCD","Microscopic Examination Short Name","Char","C89974",,"","Topic","Short name of the measurement, test, or examination described in MITEST. It can be used as a column name when converting a dataset from a vertical to a horizontal format. The value in MITESTCD cannot be longer than 8 characters, nor can it start with a number (e.g., ""1TEST"" is not valid). MITESTCD cannot contain characters other than letters, numbers, or underscores. Examples: HER2, BRCA1, TTF1.","Req"
"SDTMIG v3.2","9","Findings","MI","MITEST","Microscopic Examination Name","Char","C89973",,"","Synonym Qualifier","Verbatim name of the test or examination used to obtain the measurement or finding. The value in MITEST cannot be longer than 40 characters. Examples: Human Epidermal Growth Factor Receptor 2, Breast Cancer Susceptibility Gene 1, Thyroid Transcription Factor 1.","Req"
"SDTMIG v3.2","10","Findings","MI","MITSTDTL","Microscopic Examination Detail","Char","",,"","Record Qualifier","Further description of the test performed in producing the MI result. This would be used to represent specific attributes, such as intensity score or percentage of cells displaying presence of the biomarker or compound","Perm"
"SDTMIG v3.2","11","Findings","MI","MICAT","Category for Microscopic Finding","Char","",,"","Grouping Qualifier","Used to define a category of related records.","Perm"
"SDTMIG v3.2","12","Findings","MI","MISCAT","Subcategory for Microscopic Finding","Char","",,"","Grouping Qualifier","Used to define a further categorization of MICAT.","Perm"
"SDTMIG v3.2","13","Findings","MI","MIORRES","Result or Finding in Original Units","Char","",,"","Result Qualifier","Result of the histopathology measurement or finding as originally received or collected.","Exp"
"SDTMIG v3.2","14","Findings","MI","MIORRESU","Original Units","Char","C71620",,"","Variable Qualifier","Original unit for MIORRES.","Perm"
"SDTMIG v3.2","15","Findings","MI","MISTRESC","Character Result/Finding in Standard Format","Char","",,"","Result Qualifier","Contains the result value for all findings, copied or derived from MIORRES in a standard format or standard units. MISTRESC should store all results or findings in character format; if results are numeric, they should also be stored in numeric format in MISTRESN.","Exp"
"SDTMIG v3.2","16","Findings","MI","MISTRESN","Numeric Result/Finding in Standard Units","Num","",,"","Result Qualifier","Used for continuous or numeric results or findings in standard format; copied in numeric format from MISTRESC. MISTRESN should store all numeric test results or findings.","Perm"
"SDTMIG v3.2","17","Findings","MI","MISTRESU","Standard Units","Char","C71620",,"","Variable Qualifier","Standardized unit used for MISTRESC and MISTRESN.","Perm"
"SDTMIG v3.2","18","Findings","MI","MIRESCAT","Result Category","Char","",,"","Result Qualifier","Used to categorize the result of a finding.  Examples: MALIGNANT or BENIGN for tumor findings.","Perm"
